10:24:10.485623 ARP, Request who-has 192.168.0.2 tell 192.168.0.1, length 46
10:24:11.514446 ARP, Request who-has 192.168.0.2 tell 192.168.0.1, length 46
10:24:12.539227 ARP, Request who-has 192.168.0.2 tell 192.168.0.1, length 46
10:24:16.570515 ARP, Request who-has 192.168.0.4 tell 192.168.0.1, length 46
10:24:16.570555 ARP, Reply 192.168.0.4 is-at 08:00:27:b6:98:3b (oui Unknown), length 28
10:24:16.745967 ARP, Request who-has 192.168.0.1 tell 192.168.0.4, length 28
10:24:16.746559 ARP, Reply 192.168.0.1 is-at 08:00:27:70:cb:18 (oui Unknown), length 46
10:24:30.340437 IP 192.168.0.1 > 192.168.0.4: ICMP echo request, id 1044, seq 1, length 64
10:24:30.340497 IP 192.168.0.4 > 192.168.0.1: ICMP echo reply, id 1044, seq 1, length 64
10:24:31.343632 IP 192.168.0.1 > 192.168.0.4: ICMP echo request, id 1044, seq 2, length 64
10:24:31.343691 IP 192.168.0.4 > 192.168.0.1: ICMP echo reply, id 1044, seq 2, length 64
10:24:32.345493 IP 192.168.0.1 > 192.168.0.4: ICMP echo request, id 1044, seq 3, length 64
10:24:32.345544 IP 192.168.0.4 > 192.168.0.1: ICMP echo reply, id 1044, seq 3, length 64

