21:45:06.178452 IP 192.168.1.2.67 > 192.168.1.100.68: BOOTP/DHCP, Reply, length 306
21:45:16.199379 IP 192.168.1.2.67 > 192.168.1.100.68: BOOTP/DHCP, Reply, length 306
21:45:26.211952 IP 192.168.1.2.67 > 192.168.1.100.68: BOOTP/DHCP, Reply, length 306
21:45:36.224990 IP 192.168.1.2.67 > 192.168.1.100.68: BOOTP/DHCP, Reply, length 306
21:45:42.925255 IP 192.168.1.101.68 > 192.168.1.2.67: BOOTP/DHCP, Request from 08:00:27:9f:f1:d9, length 300
21:46:05.750324 IP 192.168.1.2.67 > 192.168.1.101.68: BOOTP/DHCP, Reply, length 306
21:46:15.767477 IP 192.168.1.2.67 > 192.168.1.101.68: BOOTP/DHCP, Reply, length 306
21:46:25.780072 IP 192.168.1.2.67 > 192.168.1.101.68: BOOTP/DHCP, Reply, length 306
21:47:00.312363 IP 192.168.1.2.67 > 192.168.1.102.68: BOOTP/DHCP, Reply, length 306
21:47:10.380978 IP 192.168.1.2.67 > 192.168.1.102.68: BOOTP/DHCP, Reply, length 306

